,Username,Tweet,Date,Number of Retweets,Number of Likes,Number of Followers
0,MuseumModernArt,"For Alzheimer’s and Brain Awareness Month, @MoMAlearning has put together ideas and prompts for caregivers to promote communication and wellness through art. In English and Spanish! https://t.co/szkKwEv6g1 https://t.co/khHreFbcXT",2020-06-25 20:38:02,16,87,5357233
1,MuseumModernArt,"Tonight's the night! At 8 p.m. EDT, we're hosting the online premiere of @tourmaliiine's Salacia. The artist’s film, new to our collection, reimagines the life of Mary Jones. https://t.co/9Ea7S3F91o https://t.co/bZLSusNNIm",2020-06-25 15:36:05,29,56,5357233
2,MuseumModernArt,"Through interviews with members of two women's tackle football teams, Sharon Hayes’s Artist Project conveys pressing issues of gender and equity that inform both football and life beyond the field. https://t.co/J8r0TXHqTp https://t.co/wKWHowhlQa",2020-06-24 22:00:29,3,31,5357233
3,MuseumModernArt,"In the first edition of Performing at a Distance, our new artist project series that unfolds with one letter a week, Steffani Jemison reflects on Lorraine Hansberry’s, What Use Are Flowers?, which imagines the world after the end of the world. https://t.co/24BlA4Ss1D https://t.co/7ejsRzxQPB",2020-06-23 22:20:02,21,88,5357233
4,MuseumModernArt,"“Mundane, odd, incredibly out of place. But there is such beauty (dare I say, elevated to actual art!) and that’s a good way to look at the mundanity of every day in this pandemic.” — Jen Forcino

More #MoMAPicks: https://t.co/9ro9NjZPss

👞 Robert Gober, Untitled Leg https://t.co/MLJFjPKrTP",2020-06-23 15:44:02,28,178,5357233
5,MuseumModernArt,@tourmaliiine 🥰 We can't wait for the premiere on Thursday!,2020-06-22 20:19:27,1,21,5357233
6,MuseumModernArt,@tourmaliiine Can't wait! https://t.co/SOUQp0CVm3,2020-06-22 20:12:39,0,0,5357233
7,MuseumModernArt,@nuts2soup @tourmaliiine No tickets required! Check back here on Thursday AM for a link to the screening and more info. All are welcome :),2020-06-22 20:10:55,5,49,5357233
8,MuseumModernArt,"Thursday at 8pm, join us for the online premiere of @tourmaliiine’s Salacia. The film, starring Rowin Amone, and produced by Keanu Reeves, offers a speculative vision of Mary Jones, a Black trans woman and sex worker who lived in SoHo in the 1830s.

📸 Matt Harvey https://t.co/v4Z1isbVik",2020-06-22 19:45:05,349,1131,5357233
9,MuseumModernArt,"Since Gilbert Baker first unfurled the Rainbow Flag at the San Francisco Gay and Lesbian Freedom Day Parade in 1978, his iconic design has stood as a powerful symbol of #Pride — acceptance, community, diversity, and, above all, love.

Learn more: https://t.co/wCUFmc0whG https://t.co/G63bkhDqcz",2020-06-22 18:55:02,30,158,5357233
10,MuseumModernArt,"Happy Father's Day! What did your dad teach you? 

📸  William Eggleston, ""Memphis,"" c. 1969 https://t.co/356rdj4uGE https://t.co/bJpOjxU9Wo",2020-06-21 14:30:08,32,178,5357233
11,MuseumModernArt,Let's take art history apart and reimagine it. https://t.co/uCrZMcGXon,2020-06-21 00:33:00,24,105,5357233
12,MuseumModernArt,"“This map of American violence is incomplete. Please write in whatever you find lacking.”

Across “United States of Attica,” Faith Ringgold recorded scores of violent, often racist, atrocities, inviting viewers to fill in the gaps. https://t.co/lCMGykzHQ3
#MoMAVirtualViews https://t.co/5dVdwSv39G",2020-06-20 18:54:03,44,123,5357233
13,MuseumModernArt,"On the 20th anniversary of #WorldRefugeeDay, Yara Said reflects on designing the Refugee Flag. The artist found inspiration in orange life vests and her personal experience of crossing the sea from Turkey to Greece. https://t.co/NDaCUp71Uk https://t.co/Yl1xWULWCp",2020-06-20 14:32:01,34,84,5357233
14,MuseumModernArt,"In addition to making art, Faith Ringgold is the author and illustrator of many children’s books. Watch Ringgold read her book, Tar Beach, with your family. Then make your own art inspired by her work and ideas: https://t.co/9MvwMbPgrC https://t.co/1FLNbtD3Yu",2020-06-20 00:25:01,36,170,5357233
15,MuseumModernArt,"These four tintypes were produced in a studio (note the painted backdrops and props), which helped the sitters stay still so the image wouldn’t be blurred.
📷 https://t.co/HcXa33bG0Y https://t.co/6uAxJhfIev",2020-06-19 15:35:44,6,42,5357233
16,MuseumModernArt,"The tintype—actually a thin sheet of iron, not tin—was a popular new process: quick, inexpensive, and durable. You could even carry one in your pocket.
📷 https://t.co/KtViIAez3X https://t.co/EWdSMVG60f",2020-06-19 15:35:44,8,49,5357233
17,MuseumModernArt,"Having a portrait taken is an act of self-representation, an act made easier by the increasing democracy of photography itself in the years after June 19, 1865, when news reached the last enslaved people in Galveston, Texas, that they were free.
📷 https://t.co/eiI6pc3tpy https://t.co/QM5Q59ERn8",2020-06-19 15:35:43,4,23,5357233
18,MuseumModernArt,"Celebrate #JUNETEENTH2020 by looking back at some of the faces of emancipated Black citizens seen in photographs from the 1870s. [THREAD]
📷 https://t.co/hXwbAEGuq1 https://t.co/IQLQn5M3AA",2020-06-19 15:35:42,60,179,5357233
19,MuseumModernArt,"“The first time I saw it, it flattened me with its truthfulness and honesty and also for how much love was needed to endure its making.” Read Crystal Williams's poem inspired by Faith Ringgold's ""Die"": https://t.co/VGpJ1YgqJC https://t.co/MGHlrSOGtu",2020-06-18 22:00:01,48,172,5357233
20,MuseumModernArt,"For more than 50 years, Faith Ringgold has grappled with issues of race, identity, and violence in her artwork as well as her activism.

Join Ringgold and curator Anne Umland tonight at 8 p.m. EDT for a live Q&amp;A to launch our #MoMAVirtualViews: https://t.co/lCMGykzHQ3 https://t.co/KBHrnM5rOS",2020-06-18 15:57:11,58,129,5357233
21,MuseumModernArt,"The Propellor Group's “The Living Need Light, The Dead Need Music” connects mourning rituals in New Orleans and Saigon. “Across time and place, public grief is a common need,"" curator Thomas Lax reflects. Stream the film: https://t.co/STXtgdRZ9H https://t.co/FoLdWXrGau",2020-06-17 21:32:04,15,103,5357233
22,MuseumModernArt,"""I’m not done yet. I’ve got so much more to do.”

Faith Ringgold spoke with @nytimesarts about finding creative inspiration in the recent protests: https://t.co/xAe46TZZGa

This Thursday, join the artist and curator Anne Umland live for #MoMAVirtualViews: https://t.co/tAo6nT4AsQ https://t.co/P4FMqbaEtf",2020-06-15 15:35:00,48,215,5357233
23,MuseumModernArt,"In the late 1970s, Pope.L began a set of street performances—which he called crawls—using his body to pose questions about division and inequality on the streets and stages of NYC. Discover the artist's landmark performances: https://t.co/c9MO5dgcvV https://t.co/yjnkCjoPMO",2020-06-12 15:14:30,35,100,5357233
24,MuseumModernArt,Join us tonight for the online premiere of Herbert Danska’s Right On!—a powerful document of radical black politics in 1960s America—with a special introduction from Felipe Luciano of the original Last Poets. https://t.co/elwlcEMF44 https://t.co/61LNNVCHLS,2020-06-11 21:08:35,104,275,5357233
25,MuseumModernArt,"“The way that history is represented and told is never neutral.” Leah Dickerman reflects on protesters' calls to remove Confederate monuments “as a response to flesh-and-blood outrage over Black lives lost and disregarded.” https://t.co/6FOJx5uohf

Projection/Photo: Dustin Klein https://t.co/a6GDfW2tpS",2020-06-10 21:15:04,31,75,5357233
26,MuseumModernArt,"Song Dong's 1996 performance “Breathing” took place in two charged public spaces in Beijing—and speaks to the way that art is intertwined with living, resistance as well as futility. Explore defiant works made in the wake of the Tiananmen Square protests: https://t.co/BnfWQ36Fpv https://t.co/L0L3Licmmh",2020-06-09 22:11:02,36,130,5357233
27,MuseumModernArt,"We’re ending the day with Alma Woodsey Thomas’s “Fiery Sunset.” The artist's radiantly colorful paintings were inspired by nature, and pushed to the edge of abstraction. Dark strokes are concentrated at the top left of the canvas, suggesting the gradual victory of night over day. https://t.co/kFKXWxL5hA",2020-06-05 21:47:02,67,220,5357233
28,MuseumModernArt,"To offer a space for reflection, join us at 8pm tonight for a special showing of Arthur Jafa’s ""akingdoncomethas."" The video posits the possibility of life after catastrophe, and offers an opportunity to come together in ritual and action https://t.co/J7nA7Thpcq https://t.co/14nQHinnVv",2020-06-04 20:47:36,9,42,5357233
29,MuseumModernArt,There are so many ways to join the fight for justice and equality. Explore our ongoing list and share your resources in the comments below to help us add to it. https://t.co/e1UJoOLlfL https://t.co/uVJU9EtWqB,2020-06-04 14:05:03,57,113,5357233
30,MuseumModernArt,"We grieve with the families of George Floyd, Breonna Taylor, Ahmaud Arbery, David McAtee and Tony McDade—and with so many others in America's black communities—who have suffered appalling losses and live in fear because of racism, abuse, violence and injustice. #BlackLivesMatter https://t.co/5OvKD222mj",2020-06-02 03:52:35,83,329,5357233
31,MuseumModernArt,"At this time of intolerable tragedy and violence, we must all unite in rejecting racism and injustice and commit to building a future of safety, peace, and equity for all. https://t.co/KzJhZNFuog",2020-06-01 21:51:25,20,72,5357233
32,MuseumModernArt,The “body print” speaks to what Hammons described as his “moral obligation as a black artist to try to graphically document what I feel socially.” https://t.co/VKG4czLuqM,2020-06-01 21:51:24,13,59,5357233
33,MuseumModernArt,"An image of the artist David Hammons draped in the American flag, his hands joined in prayer, “Pray for America” was created during a time of nationwide protests, race riots, and anti-war demonstrations. https://t.co/f6LL0qCy6m",2020-06-01 21:51:24,60,177,5357233
34,MuseumModernArt,"From the 1950s on, the language of abstraction became synonymous with modernity in South America. Artists aimed to reinvent art and society, their efforts reverberating across architecture, design, landscape design. Explore the #MoMAVirtualViews: https://t.co/hSpnFm1fVN https://t.co/KTu3I8IQTf",2020-05-29 19:01:27,91,250,5357233
35,MuseumModernArt,"While you listen, consider the influence of music on Alejandro Otero’s “Colorhythm” works. Shapes glide, float, and sink against the bands, in what the Venezuelan artist called “an open directional rhythm.” Explore more: https://t.co/hSpnFmiQNl https://t.co/pvKwy8hHyq",2020-05-29 14:27:36,17,58,5357233
36,MuseumModernArt,"Listen to a playlist scoring the abstract art featured in #SurModerno: https://t.co/eevd1lqD1d

Like these artists, 20th-century Latin American composers engaged with new aesthetic languages emerging from Europe while attempting to find a distinct artistic voice. https://t.co/5yRW12tTK2",2020-05-29 14:27:36,29,118,5357233
37,MuseumModernArt,"“These artists wanted to reimagine the world.” Curator Inés Katzenstein introduces #SurModerno. In the postwar years, South American artists pushed the boundaries of art and looking. Explore our #MoMAVirtualViews: https://t.co/hSpnFm1fVN https://t.co/6EP4tYVLQs",2020-05-28 20:32:47,22,71,5357233
38,MuseumModernArt,"Tune in tonight, May 28, at 8:00 p.m. EDT for a live Q&amp;A with curator Inés Katzenstein and Gabriel Pérez-Barreiro, Senior Advisor to @cppcisneros, about the exhibition: https://t.co/urb3ZwALyW https://t.co/M8KQHjHy5V",2020-05-28 15:01:58,19,64,5357233
39,MuseumModernArt,"Discover the transformative power of abstraction in Brazil, Venezuela, Argentina, and Uruguay at midcentury, when artists reinvented the art object—and the role of art in society. Explore #SurModerno, our latest #MoMAVirtualViews: https://t.co/hSpnFm1fVN https://t.co/mmfZ6UCF1T",2020-05-28 15:01:58,60,210,5357233
40,MuseumModernArt,Our Architecture and Design team has assembled a trove of essential reading on how the current global crisis affects all aspects of our daily lives and how we might begin to design our future. https://t.co/FPOu98khrQ https://t.co/mALrM9rl5r,2020-05-27 21:00:16,48,170,5357233
41,MuseumModernArt,"We're screening Arthur Jafa's 2018 video “akingdoncomethas” on #MoMAMagazine every day from 12-3 p.m. EDT through June 2! Before the first showing, drop in with the artist and curator Thomas Lax on our Instagram Live at noon. https://t.co/J7nA7Thpcq https://t.co/QuTKh4DN7n",2020-05-27 13:52:05,28,89,5357233
42,MuseumModernArt,"“At a time when our world is flipped upside-down, Christina is an anchor, an enduring presence. She never looks back... But one day, I know, our gazes will meet.” —Keith Daly

Our staff share artworks they look to for solace and perspective: https://t.co/9ro9NkhqR2
#MoMAPicks https://t.co/sh1QgUoRTx",2020-05-26 21:42:02,133,553,5357233
43,MuseumModernArt,"To create this photogram, Man Ray exposed photographic paper to light at least 3 times, each pass with different pairs of objects acting as stencils: hands, heads kissing, and darkroom trays. A perfect art experiment for a sunny day. ☀️No camera needed! https://t.co/VzF22o6I4k https://t.co/0ByLKAlUEb",2020-05-26 17:45:03,58,182,5357233
44,MuseumModernArt,"This #MemorialDay, we’re ringing in the unofficial start of summer with a virtual picnic, inspired by Stephen Frykohlm’s delectable posters 🍉🍔🌽🥧https://t.co/A4ELsMzt2y https://t.co/Kc8c2nBqet",2020-05-25 17:30:09,46,245,5357233
45,MuseumModernArt,"Sharing some #SundayVibes from photographer William Eggleston.

Get in the right state of mind to enjoy your day—from mindful walks to drawing prompts, we’ve got your guide to connectedness and healing through art: https://t.co/3hdrWtLRsE https://t.co/IJ4qMMOWVk",2020-05-24 16:46:02,28,166,5357233
46,MuseumModernArt,"“Basically everything in the world is a shape…every edge, corner, blob, form, silhouette, or negative space is something you have to navigate to get through a room."" —Amy Sillman

Explore https://t.co/wkNSI6w9Qk
#MoMAVirtualViews

🔹Romare Bearden
🔻Arshile Gorky
🔸Auguste Rodin https://t.co/1PNLFNcZuB",2020-05-23 17:20:04,47,187,5357233
47,MuseumModernArt,"Amy Sillman has helped push the medium of painting into drawing, installations, video, and zines. “All accidents and experiments, and discoveries, are what my work is about,” the artist has said. Explore Sillman’s #MoMAVirtualViews, ""The Shape of Shape"": https://t.co/wkNSI6w9Qk https://t.co/mQWzfjSgPJ",2020-05-22 21:50:03,13,89,5357233
48,MuseumModernArt,"“Everyone has a personal shape,” artist Amy Sillman reminds us: A shadow. Consider the shapes we carry with us in our #MoMAVirtualViews, ""The Shape of Shape"": https://t.co/wkNSI6w9Qk

👥Lee Friedlander
👥Ernst Ludwig Kirchner
👥Francis Picabia
👥Gertrude Greene https://t.co/voVW537WBw",2020-05-22 18:40:05,49,173,5357233
49,MuseumModernArt,"""If you think of shape as figure/ground, then every shape is a figure and the ground is the whole world,” artist Amy Sillman muses. Explore our #MoMAVirtualViews “The Shape of Shape"": https://t.co/wkNSI6w9Qk

◾Henri Matisse
🔺Hannah Wilke
🔸Chris Ofili
▫️Christina Ramberg https://t.co/yMfUXUbvvr",2020-05-21 22:58:04,59,267,5357233
50,MuseumModernArt,"Join Amy Sillman in conversation with Michelle Kuo tonight at 8:00 p.m. EDT as they talk about the importance of shape, the shape-making outliers of art history, and Sillman’s new zine: https://t.co/wGgYvi1fqn https://t.co/8IsNIe9RKQ",2020-05-21 15:48:55,6,68,5357233
51,MuseumModernArt,"Curator Michelle Kuo introduces “Amy Sillman: The Shape of Shape,” our latest #MoMAVirtualViews. Explore Sillman's highly personal exploration of shape—the ever-shifting boundaries that define what and how we see—in modern art: https://t.co/wkNSI6w9Qk https://t.co/Zz81VsL9or",2020-05-21 15:48:55,21,75,5357233
52,MuseumModernArt,"Spring blooms courtesy of Ruth Asawa  🌺🌷🌸🌼

These lithographs are from the artists' 1965 portfolio, ""Flowers."" Still fresh! 💐 https://t.co/PL9CNa1IC1",2020-05-20 21:40:06,121,397,5357233
53,MuseumModernArt,"Wolfgang Tillmans shares music about being on your own but not alone. The photographer sings against sounds of the NYC subway. As he observes, “field recording sounds are a kind of audio photography.” Listen here: https://t.co/LbekUWlqeq

📸Wolfgang Tillmans, “Smokin’ Jo” https://t.co/Tk8WdrieIE",2020-05-20 17:11:06,8,68,5357233
54,MuseumModernArt,"Remembering the joys of getting dressed up for a night on the town 💃

Henri Toulouse-Lautrec shows the Moulin Rouge’s star performer, Louise Weber (nicknamed La Goulue, or ""the glutton""), in the famous Paris cabaret with her sister and lover. Learn more: https://t.co/LgVQMi6sDh https://t.co/K5ip6lFBMv",2020-05-19 20:03:02,52,286,5357233
55,MuseumModernArt,"We're excited to share that not 1, not 2, but 3 of our publications—MoMA PS1: A History, Among Others, and Frances Benjamin Johnston—have been selected by @aigadesign as 50 Books | 50 Covers winners for 2019! Explore the titles: https://t.co/3K6117Lydk
#AIGA5050 https://t.co/vUlMmberXV",2020-05-18 21:18:06,18,86,5357233
56,MuseumModernArt,"Amy Sillman’s new zine takes up where her exhibition “The Shape of Shape,” launching this Thursday in our #MoMAVirtualViews, left off: with an exploration of the little-known histories of shape in modern art. Read an excerpt and download the entire zine: https://t.co/wmOPAWJyGB https://t.co/RiwdjCIMKw",2020-05-18 19:47:02,17,71,5357233
57,MuseumModernArt,"Drop in to an intimate conversation with artist Wolfgang Tillmans and curator Roxana Marcoci on our Instagram Live this Wednesday, May 20 at 12pm: https://t.co/7bWg4dC0Ix https://t.co/Xugx91bkSH",2020-05-18 19:00:22,11,51,5357233
58,MuseumModernArt,"“Like many of us, I am quarantined with my entire immediate family. Despite the moments when our faces might resemble the family members in Marisol's portrait, we are a unit."" — Emily Shoyer

Our staff share artworks they look to for solace: https://t.co/9ro9NkhqR2
#MoMAPicks https://t.co/ybdVElwl7m",2020-05-18 17:31:02,35,136,5357233
59,MuseumModernArt,"Who else is spending a #lazySunday lounging around and thinking about art?The languorous pose of Modigliani's “Reclining Nude” (c. 1919) references classical depictions of Venus, yet her frank sexuality is also inspired by avant-garde provocateurs like Manet. https://t.co/BA9Rt9x5k0",2020-05-17 17:36:01,114,703,5357233
60,MuseumModernArt,Ours too! Explore Neri Oxman's big ideas for the future of architecture and design in our #MoMAVirtualViews: https://t.co/diaWzPuD8e https://t.co/JXCvFbDGN1,2020-05-16 23:00:00,3,20,5357233
61,MuseumModernArt,"Frederick Kiesler’s “Endless House Project” offered an alternative to modernism's glass facades: a biomorphic, shape-shifting design. Neri Oxman shares how his unconventional approach inspired her own interest in the architectural possibilities of nature: https://t.co/BiiTOhpUH4 https://t.co/M7EBH6rVh0",2020-05-16 22:09:01,16,80,5357233
62,MuseumModernArt,"A new era of ecological awareness is upon us! Explore Neri Oxman's quest to create tools for a better future by harnessing the genius of nature in our catalogue, Material Ecology. Get your copy: https://t.co/hoWiJ0z961

In the meantime, read an excerpt: https://t.co/X2YzNwphj5 https://t.co/lVfsu1qzH3",2020-05-16 00:19:02,13,68,5357233
63,MuseumModernArt,"Can humans collaborate with other species to create a more sustainable future?

Neri Oxman and @medialab sought to answer this question with Silk Pavilion II, featuring 17,000 silkworms!  

Explore 💻 +🐛collaborations in our #MoMAVirtualViews: https://t.co/diaWzPuD8e https://t.co/M89zF9HhtD",2020-05-15 21:47:26,39,183,5357233
64,MuseumModernArt,"“In my early work I tried to hide my personality, my psychological state, my emotions, but eventually it seemed like a losing battle. Finally one must simply drop the reserve.” —Jasper Johns

Happy 90th birthday #JasperJohns! https://t.co/VrLyjSiyN8 https://t.co/jMiGg6ugDx",2020-05-15 16:10:04,55,201,5357233
65,MuseumModernArt,"No, you're not watching a paint tube being squeezed—that’s molten glass oozing from the world’s first Glass 3D Printer, developed by Neri Oxman and @mitmedialab! Explore more designs for the future: https://t.co/diaWzPMewO https://t.co/5N0Y5wY5qL",2020-05-14 23:17:11,94,340,5357233
66,MuseumModernArt,"Tonight at 8 p.m. EDT, join Paola Antonelli (@curiousoctopus) and Neri Oxman for a live discussion about the exhibition, her work, and the power of design.

A special thank you to @Allianz, MoMA's partner for design and innovation, for making this exhibition possible. https://t.co/7rz74qNsH8",2020-05-14 18:29:37,6,31,5357233
67,MuseumModernArt,"“Nature does it best. It designs best. It builds best, it destroys best.”

Neri Oxman envisions collaborations between humans and nature to create a more sustainable future of design. Curator Paola Antonelli kicks off #MoMAVirtualViews: https://t.co/diaWzPMewO https://t.co/EifAKvUa75",2020-05-14 18:29:36,30,81,5357233
68,MuseumModernArt,"Anicka Yi shares her recipe for lemon pasta with parmesan, peas, and fresh herbs as part of our ongoing series ""Cooking with Artists"" with chef Mina Stone and @MoMAPS1: https://t.co/rDCBKbWk86 https://t.co/oNX1ygQWfd",2020-05-13 21:25:04,29,154,5357233
69,MuseumModernArt,The Greatest Films You’ve Never Seen 🎞️ 📽️ 👀 @josh13siegel and @momafilm created a comprehensive streaming list to indulge any cinephile’s needs: https://t.co/7PrL16cuvE https://t.co/EJhkBMysxi,2020-05-13 18:19:02,32,63,5357233
70,MuseumModernArt,"“For Zarina, home was not defined as the faraway place of her childhood but wherever she had decided to settle. Home was a present-tense verb.” Staff members pay tribute to the late artist, who died on Apr 25. Read more on #MoMAMagazine: https://t.co/dqM0GUBD6K https://t.co/rWIeKXM95L",2020-05-12 21:43:04,51,229,5357233
71,MuseumModernArt,"It's never been more important to come together in support of our creative communities. We’ve compiled a brief list of grants, counsel, and care resources for artists during this crisis: https://t.co/VbIHX4WcjW https://t.co/eIvGqgd4MR",2020-05-12 20:04:02,34,128,5357233
72,MuseumModernArt,"Neri Oxman’s work celebrates a new age in which biology, architecture, engineering, and design join forces to build the future. Our #MoMAVirtualViews starts May 14 with a live Q&amp;A with Oxman and curator Paola Antonelli, plus explore audio, video, and more: https://t.co/nYQmNiMdPu https://t.co/EVSvpAhrOi",2020-05-11 21:25:29,54,152,5357233
73,MuseumModernArt,"A truly timeless look!
🕐🕑🕒🕓🕔🕕 https://t.co/HS0YvzWYFQ",2020-05-11 18:22:20,56,325,5357233
74,MuseumModernArt,"""In this moment when we are trying to make the most of the view from our windows, I find this painting to be a reassuring meditation on the infinite vistas in front of us yet.” —@prudencepeiffer

Our staff share artworks they look to for solace: https://t.co/9ro9NkhqR2
#MoMAPicks https://t.co/qjpX4sou3T",2020-05-11 17:11:09,52,168,5357233
75,MuseumModernArt,How about a rose for mom on #MothersDay? Isa Genzken’s supersized sculpture of a flower matches the scale of NYC buildings. Play with perspective and scale in a drawing or photo. Send a picture of what you make to your mom—she’ll love it no matter what! https://t.co/yCpei9bfgQ https://t.co/ndPm7TqSLU,2020-05-10 15:30:09,17,104,5357233
76,MuseumModernArt,"We’re bidding you and our Sculpture Garden a good night! (Is that Picasso’s She-Goat we hear snoring?)

Discover more beautiful scenes from the #MoMAGarden’s eighty-year history in an excerpt from our publication “Oasis in the City”: https://t.co/LwQgVDGztI
#MoMAVirtualViews https://t.co/YqQYPrefol",2020-05-09 22:33:02,32,170,5357233
77,MuseumModernArt,"How satisfying is that? One year ago, the master riggers of Budco made it look easy to thread the needle with Barnett Newman's multi-ton ""Broken Obelisk."" Get an inside look at how art in the #MoMAGarden came to life during our reinstallation: https://t.co/GpFBobkhcR https://t.co/bKIosAQLdz",2020-05-09 17:29:09,51,337,5357233
78,MuseumModernArt,"Treat yourself to a #SelfCareSaturday. Meditate and explore art and nature in our Sculpture Garden audio guide, made possible by @BloombergDotOrg.

We think we’ll sit right down underneath Hector Guimard’s Paris subway gate. https://t.co/FhjAsK7Nlz
#MoMAVirtualViews https://t.co/kEVchZ6Zkw",2020-05-09 13:36:02,37,147,5357233
79,MuseumModernArt,Watch Jean Tinguely's work self-destruct in the Sculpture Garden in Robert Breer’s documentation of the 1960 event—which ended with a firefighter finishing off the piece with an axe! The 4-day-only screening is as part of our #MoMAVirtualViews: https://t.co/mQVB8JScI4 https://t.co/K47hseP2Ms,2020-05-09 00:35:02,36,117,5357233
80,MuseumModernArt,#FBF Remembering some of the most incredible moments in our Sculpture Garden’s more than 80 year history. A standout: when Yayoi Kusama staged an unauthorized orgy in 1969. “But is it art?” read the next day’s headline! Explore more highlights: https://t.co/mQVB8JScI4 https://t.co/gaPAjpavGa,2020-05-08 18:30:10,57,224,5357233
81,MuseumModernArt,"One of life's great pleasures!

While we can't be there together now, take the afternoon to relax in our Sculpture Garden in our #MoMAVirtualViews: https://t.co/yCpei9bfgQ https://t.co/EWLxtCRRqK",2020-05-08 16:22:56,4,19,5357233
82,MuseumModernArt,💏 https://t.co/PuZetJ4FHf,2020-05-08 14:19:56,3,50,5357233
