,Username,Tweet,Date,Number of Retweets,Number of Likes,Number of Followers
183,ngadc,"Before it was known as #MemorialDay, the nation celebrated Decoration Day. John A. Logan, Commander and Chief of the Union’s veteran group called the Grand Army of the Republic, initiated the holiday, urging Americans to decorate the graves of the dead with flowers. https://t.co/PHLNokmiue",2020-05-25 22:27:57,8,26,259438
184,ngadc,"The memorial commemorates the valiant efforts of Colonel Robert Gould Shaw and the men of the 54th Massachusetts, the first Civil War regiment of African Americans enlisted in the North.

The version in Boston Common was dedicated as a monument on Decoration Day on May 31, 1897. https://t.co/SN5ibA8qlV",2020-05-25 22:24:17,14,40,259438
185,ngadc,"On #MemorialDay, we honor the lives of soldiers who have died while serving in the US Armed Forces. Today, we will remember them with a look at Augustus Saint-Gaudens’s “Shaw Memorial” (1900). #MuseumFromHome

Read more about the Memorial: https://t.co/2UhExVxhIE https://t.co/f5FsAQNZ4u",2020-05-25 22:24:16,87,282,259438
186,ngadc,"On #MemorialDay, read more about Mico Kaufman’s medal “Soldier Carrying a Wounded Comrade” (1973)  in a blog post by Emily Pegues, Assistant Curator, Sculpture and Decorative Arts: https://t.co/Ucoy9aoL6e https://t.co/bqaaFZmwx3",2020-05-25 15:06:02,6,22,259438
187,ngadc,"And for today’s #MuseumMomentofZen, Binh Danh’s daguerreotype, “Lower Yosemite Falls, Yosemite, CA, October 13, 2011.” https://t.co/eGZwG0oUFn",2020-05-24 19:50:51,3,21,259438
188,ngadc,"Ahead of #MemorialDay, Binh Danh’s work is a poignant remembrance of fallen soldiers.

Listen to a conversation between Danh and Robert Schultz about their “War Memoranda” exhibition, which probed the question, “How do Americans remember war?” https://t.co/CHRTMx8lMk https://t.co/xkKe5egjrK",2020-05-24 19:50:06,0,10,259438
189,ngadc,"In one view, Danh shows the hillside covered in crosses, the cumulative death toll made apparent by the crowded symbols—too many to count individually. https://t.co/LdwqdugHop",2020-05-24 19:46:40,2,7,259438
190,ngadc,"Employing the complex daguerreotype process, Danh pictures individual crosses (or in one case, a Star of David), capturing the names and personal items affixed by different citizens. https://t.co/NT0zit1tgw",2020-05-24 19:45:51,0,4,259438
